{
  "schema_version": "1.0.0",
  "campaign_id": "example-generic-command",
  "locked_at": "2026-08-24T00:00:00Z",
  "resources": [
    {
      "path": "eval/run.py",
      "digest_algorithm": "sha256",
      "digest": "e3b0c44298fc1c149afbf4c8996fb92427ae41e4649b934ca495991b7852b855"
    },
    {
      "path": "campaign.yaml",
      "digest_algorithm": "sha256",
      "digest": "568da3b15c4ea7d36b6a521f68278d754ed9ffdd8fab9ef6632c2c1e2f053881"
    }
  ]
}
